{
  "$schema": "http://json-schema.org/draft-07/schema#",
  "type": "object",
  "required": ["id","official_name","abbreviation","aliases","category","description","confusion_note","source_pdf_url","source_updated_date","provider_count","earliest_known_date","lowest_known_price_gbp"],
  "additionalProperties": false,
  "properties": {
    "id": {"type": "string", "pattern": "^[a-z0-9-]+$"},
    "official_name": {"type": "string", "minLength": 1},
    "abbreviation": {"type": ["string","null"]},
    "aliases": {"type": "array", "items": {"type": "string"}},
    "category": {"type": "string", "enum": ["stcw_basic","stcw_advanced","stcw_refresher","stcw_tanker","stcw_igf","stcw_helm","stcw_ecdis_naest","gmdss","high_voltage","security","deck_yacht","sv_engineering","engineering_other","polar","workboat","other"]},
    "description": {"type": ["string","null"]},
    "confusion_note": {"type": ["string","null"]},
    "source_pdf_url": {"type": "string", "format": "uri"},
    "source_updated_date": {"type": "string", "pattern": "^\\d{4}-\\d{2}-\\d{2}$"},
    "provider_count": {"type": "integer", "minimum": 0},
    "earliest_known_date": {"type": ["string","null"]},
    "lowest_known_price_gbp": {"type": ["number","null"], "minimum": 0}
  }
}
