[
  {
    "id": "pst",
    "official_name": "Personal Survival Techniques",
    "abbreviation": null,
    "aliases": [],
    "category": "stcw_basic",
    "description": "Covers survival at sea: lifejackets, immersion suits, life rafts, and firefighting basics. Required for most commercial certificates.",
    "confusion_note": "This is the initial PST course. If you need to renew an existing certificate, see Updating PST (UPST).",
    "source_pdf_url": "https://assets.publishing.service.gov.uk/media/6ac7a386ab368efeb4c933bc/PST_08.10.2026.pdf",
    "source_updated_date": "2026-10-08",
    "provider_count": 36,
    "earliest_known_date": "2026-10-19",
    "lowest_known_price_gbp": 125.0
  },
  {
    "id": "fpff",
    "official_name": "Fire Prevention and Fire Fighting",
    "abbreviation": null,
    "aliases": [],
    "category": "stcw_basic",
    "description": "Fire prevention and firefighting techniques. Covers fire theory, shipboard fire systems, and practical drills. Part of STCW Basic Safety Training.",
    "confusion_note": null,
    "source_pdf_url": "https://assets.publishing.service.gov.uk/media/6ac7a243e8ef5609e7c933c5/FPFF_08.10.2026.pdf",
    "source_updated_date": "2026-10-08",
    "provider_count": 24,
    "earliest_known_date": "2026-10-19",
    "lowest_known_price_gbp": 165.0
  },
  {
    "id": "efa",
    "official_name": "Elementary First Aid",
    "abbreviation": null,
    "aliases": [],
    "category": "stcw_basic",
    "description": "Provides basic first aid skills for use at sea before medical help arrives. Covers CPR, burns, and casualty care.",
    "confusion_note": null,
    "source_pdf_url": "https://assets.publishing.service.gov.uk/media/6ac7a238ab368efeb4c933aa/EFA_08.10.2026.pdf",
    "source_updated_date": "2026-10-08",
    "provider_count": 42,
    "earliest_known_date": "2026-10-18",
    "lowest_known_price_gbp": 120.0
  },
  {
    "id": "pssr",
    "official_name": "Personal Safety and Social Responsibility",
    "abbreviation": null,
    "aliases": [],
    "category": "stcw_basic",
    "description": "Covers personal safety procedures, onboard communication, and social responsibilities. Part of STCW Basic Safety Training.",
    "confusion_note": null,
    "source_pdf_url": "https://assets.publishing.service.gov.uk/media/6ac7a37bec9d3aba1e013a94/PSSR_08.10.2026.pdf",
    "source_updated_date": "2026-10-08",
    "provider_count": 31,
    "earliest_known_date": "2026-10-19",
    "lowest_known_price_gbp": 95.0
  },
  {
    "id": "aff",
    "official_name": "Advanced Fire Fighting",
    "abbreviation": null,
    "aliases": [],
    "category": "stcw_advanced",
    "description": "Advanced training in shipboard firefighting for designated firefighting team members.",
    "confusion_note": null,
    "source_pdf_url": "https://assets.publishing.service.gov.uk/media/6ac7a178e8ef5609e7c933c1/AFF_08.10.2026.pdf",
    "source_updated_date": "2026-10-08",
    "provider_count": 19,
    "earliest_known_date": "2026-10-19",
    "lowest_known_price_gbp": 180.0
  },
  {
    "id": "pscrb",
    "official_name": "Proficiency in Survival Craft and Rescue Boats",
    "abbreviation": null,
    "aliases": [],
    "category": "stcw_advanced",
    "description": "Advanced training in launching and operating survival craft and rescue boats.",
    "confusion_note": "This is the full (unrestricted) PSCRB. For the yacht-specific variant, see Yacht-Restricted PSCRB (PSCRB-R).",
    "source_pdf_url": "https://assets.publishing.service.gov.uk/media/6ac7a35fab368efeb4c933b6/PSCRB_08.10.2026.pdf",
    "source_updated_date": "2026-10-08",
    "provider_count": 12,
    "earliest_known_date": "2026-10-19",
    "lowest_known_price_gbp": 185.0
  },
  {
    "id": "pscrb-r",
    "official_name": "Yacht-Restricted Proficiency in Survival Craft and Rescue Boats",
    "abbreviation": null,
    "aliases": [],
    "category": "stcw_advanced",
    "description": "Yacht-specific variant of PSCRB, covering the survival craft found on smaller commercial yachts.",
    "confusion_note": "This is the yacht-restricted variant. For the full version, see Proficiency in Survival Craft and Rescue Boats (PSCRB).",
    "source_pdf_url": "https://assets.publishing.service.gov.uk/media/6ac7a36fab368efeb4c933bb/PSCRB-R_08.10.2026.pdf",
    "source_updated_date": "2026-10-08",
    "provider_count": 3,
    "earliest_known_date": null,
    "lowest_known_price_gbp": null
  },
  {
    "id": "mfa",
    "official_name": "Proficiency in Medical First Aid",
    "abbreviation": null,
    "aliases": [],
    "category": "stcw_advanced",
    "description": null,
    "confusion_note": null,
    "source_pdf_url": "https://assets.publishing.service.gov.uk/media/6ac7a2faab368efeb4c933af/MFA_08.10.2026.pdf",
    "source_updated_date": "2026-10-08",
    "provider_count": 24,
    "earliest_known_date": "2026-10-19",
    "lowest_known_price_gbp": 450.0
  },
  {
    "id": "mc",
    "official_name": "Proficiency in Medical Care",
    "abbreviation": null,
    "aliases": [],
    "category": "stcw_advanced",
    "description": null,
    "confusion_note": null,
    "source_pdf_url": "https://assets.publishing.service.gov.uk/media/6ac7a2edec9d3aba1e013a90/MC_08.10.2026.pdf",
    "source_updated_date": "2026-10-08",
    "provider_count": 15,
    "earliest_known_date": "2026-10-19",
    "lowest_known_price_gbp": 599.0
  },
  {
    "id": "frb",
    "official_name": "Fast Rescue Boat",
    "abbreviation": null,
    "aliases": [],
    "category": "stcw_advanced",
    "description": "Training in operation and recovery of fast rescue boats, typically required for vessels carrying fast rescue boats.",
    "confusion_note": null,
    "source_pdf_url": "https://assets.publishing.service.gov.uk/media/6ac7a24df1ba855cc196a966/FRB_08.10.2026.pdf",
    "source_updated_date": "2026-10-08",
    "provider_count": 6,
    "earliest_known_date": "2026-10-21",
    "lowest_known_price_gbp": 185.0
  },
  {
    "id": "ufpff",
    "official_name": "Updating Fire Prevention and Fire Fighting",
    "abbreviation": null,
    "aliases": [],
    "category": "stcw_refresher",
    "description": null,
    "confusion_note": null,
    "source_pdf_url": "https://assets.publishing.service.gov.uk/media/6ac7a495e8ef5609e7c933d2/UFPFF_08.10.2026.pdf",
    "source_updated_date": "2026-10-08",
    "provider_count": 22,
    "earliest_known_date": "2026-10-21",
    "lowest_known_price_gbp": 385.0
  },
  {
    "id": "uaff",
    "official_name": "Updating Advanced Fire Fighting",
    "abbreviation": null,
    "aliases": [],
    "category": "stcw_refresher",
    "description": null,
    "confusion_note": null,
    "source_pdf_url": "https://assets.publishing.service.gov.uk/media/6ac7a489e8ef5609e7c933d1/UAFF_08.10.2026.pdf",
    "source_updated_date": "2026-10-08",
    "provider_count": 18,
    "earliest_known_date": "2026-10-22",
    "lowest_known_price_gbp": 299.0
  },
  {
    "id": "upst",
    "official_name": "Updating Personal Survival Techniques",
    "abbreviation": null,
    "aliases": [],
    "category": "stcw_refresher",
    "description": null,
    "confusion_note": "This is the refresher/updating course. For the initial certificate, see Personal Survival Techniques (PST).",
    "source_pdf_url": "https://assets.publishing.service.gov.uk/media/6ac7a4dee8ef5609e7c933d4/UPST_08.10.2026.pdf",
    "source_updated_date": "2026-10-08",
    "provider_count": 24,
    "earliest_known_date": "2026-10-20",
    "lowest_known_price_gbp": 195.0
  },
  {
    "id": "upscrb",
    "official_name": "Updating Proficiency in Survival Craft and Rescue Boats",
    "abbreviation": null,
    "aliases": [],
    "category": "stcw_refresher",
    "description": null,
    "confusion_note": null,
    "source_pdf_url": "https://assets.publishing.service.gov.uk/media/6ac7a4c4f1ba855cc196a979/UPSCRB_08.10.2026.pdf",
    "source_updated_date": "2026-10-08",
    "provider_count": 12,
    "earliest_known_date": "2026-10-19",
    "lowest_known_price_gbp": 299.0
  },
  {
    "id": "upscrb-r",
    "official_name": "Updating Yacht-Restricted Proficiency in Survival Craft and Rescue Boats",
    "abbreviation": null,
    "aliases": [],
    "category": "stcw_refresher",
    "description": null,
    "confusion_note": null,
    "source_pdf_url": "https://assets.publishing.service.gov.uk/media/6ac7a4d4b016250bca013a82/UPSCRB-R_08.10.2026.pdf",
    "source_updated_date": "2026-10-08",
    "provider_count": 3,
    "earliest_known_date": null,
    "lowest_known_price_gbp": null
  },
  {
    "id": "umc",
    "official_name": "Updated Proficiency in Medical Care",
    "abbreviation": null,
    "aliases": [],
    "category": "stcw_refresher",
    "description": null,
    "confusion_note": null,
    "source_pdf_url": "https://assets.publishing.service.gov.uk/media/6ac7a4b6b016250bca013a81/UMC_08.10.2026.pdf",
    "source_updated_date": "2026-10-08",
    "provider_count": 11,
    "earliest_known_date": null,
    "lowest_known_price_gbp": null
  },
  {
    "id": "ufrb",
    "official_name": "Updating Fast Rescue Boats",
    "abbreviation": null,
    "aliases": [],
    "category": "stcw_refresher",
    "description": null,
    "confusion_note": null,
    "source_pdf_url": "https://assets.publishing.service.gov.uk/media/6ac7a4aab016250bca013a80/UFRB_08.10.2026.pdf",
    "source_updated_date": "2026-10-08",
    "provider_count": 7,
    "earliest_known_date": null,
    "lowest_known_price_gbp": null
  },
  {
    "id": "security-awareness",
    "official_name": "Security Awareness",
    "abbreviation": null,
    "aliases": [],
    "category": "security",
    "description": "Basic security awareness training covering the ISPS Code, threat recognition, and reporting procedures.",
    "confusion_note": null,
    "source_pdf_url": "https://assets.publishing.service.gov.uk/media/6ac7a3a5a57ddfe32196a955/SA_08.10.2026.pdf",
    "source_updated_date": "2026-10-08",
    "provider_count": 23,
    "earliest_known_date": null,
    "lowest_known_price_gbp": null
  },
  {